{
  "schema_version": 1,
  "lane": "pages",
  "graded_sha256": "b79ed176ea5e0b4df178c939ee36f2d56e1678b50d7eb0d5905cf586ccb76fbb",
  "pass_nonce": "53a17d8c57f8e5a19b49c110a2deebdc",
  "verdicts": [
    {
      "id": "2026-09-09-check-docs-02/pages#1",
      "verdict": "ABSENT",
      "evidence": "verbs.md's 'Consumer setup' block (lines 26-35) no longer lists Init.migrate_seeds; only Init.init, Init.migrate_baselines, Init.new, Sync.sync, cmd_config, cmd_schema. migrate_seeds moved to docs/src/api/CLI.md:26, next to Init.derive_config, matching the hint exactly."
    },
    {
      "id": "2026-09-09-check-docs-02/pages#2",
      "verdict": "ABSENT",
      "evidence": "verbs.md 'Entry point' @docs block (lines 12-16) now reads GBGCodingTools.main / parse_options / Options — Options is rendered right after parse_options, giving the record a home as the hint requested."
    },
    {
      "id": "2026-09-09-check-docs-02/pages#3",
      "verdict": "ABSENT",
      "evidence": "verbs.md 'Checks and scans' block (line 41) now includes GBGCodingTools.Doctor.cmd_doctor. Its docstring at src/CLI/Doctor.jl:733-737 states 'gbg doctor [--deep] [--json] [--effective] [--only <id-or-prefix>[,...]|QUICK]' and the exit-2 not-a-consumer behavior verbatim."
    },
    {
      "id": "2026-09-09-check-docs-02/pages#4",
      "verdict": "ABSENT",
      "evidence": "verbs.md line 43 now includes GBGCodingTools.cmd_scan. Its docstring at src/Scan.jl:556-560 documents 'gbg scan docs [--hard-only] [--only id,...] [--rebaseline prose-shape --reason \"...\"]' and that a rebaseline writes docs/prose_shape.csv."
    },
    {
      "id": "2026-09-09-check-docs-02/pages#5",
      "verdict": "ABSENT",
      "evidence": "install.md:36-39 now adds: 'One consumer is routed differently: a consumer pinned at dev that is not itself the tool's checkout — the fixture, which sits inside that checkout — resolves against the enclosing tool repository's root rather than its own docs/.' Matches bin/gbg's fixture branch."
    },
    {
      "id": "2026-09-09-check-docs-02/pages#6",
      "verdict": "ABSENT",
      "evidence": "rounds.md:43-44 now reads 'GBG_ROUND, which the CLI exports only while it runs a build, a test or an audit's executable claim on that round's behalf' — the audit/executable-claims case is present, matching Gate.jl's own docstring and Audit.jl's behavior."
    },
    {
      "id": "2026-09-09-check-docs-02/pages#7",
      "verdict": "ABSENT",
      "evidence": "config.md:11-13 now lists 'the glossary file, and any data or script surface whose comments are prose' alongside the prior 9 items. Checked schema/config.schema.json surfaces.properties keys (11 total: rationale, pages, generated, src, ext, literate, built_html, history_exempt, references_heading, glossary, data) — all 11 now covered in prose."
    }
  ]
}
