{
  "schema_version": 1,
  "lane": "schemas",
  "graded_sha256": "9c0bccf80add89c6a05f0c08696278701eb8f5228eab2a7b944f8810562abcd6",
  "pass_nonce": "876502a63d9bafe897380fbd889ec85d",
  "verdicts": [
    {
      "id": "2026-09-10-check-docs-03/schemas#2",
      "verdict": "ABSENT",
      "evidence": "schema/audit.schema.json's properties now list only schema_version, round, base, head, kind, covered, executable_claims, dispositions, verdict_all_clean, diffstat -- no staleness, no severity_recheck. grep -rn 'staleness|severity_recheck' --exclude-dir=.gbg . finds no JSON-schema/code hits for either as a key; severity.json now has its own schema/severity.schema.json."
    }
  ]
}
