{
  "schema_version": 1,
  "lane": "rationale",
  "graded_sha256": "8d350a163e253aac46fe5fc6e8ecd1a9228b6d0e62bbfb1d2237373ed36136fd",
  "pass_nonce": "87ce050e75793878cc3b42570d620492",
  "verdicts": [
    {
      "id": "2026-09-11-check-docs-02/rationale#1",
      "verdict": "ABSENT",
      "evidence": "D10 (ARCHITECTURE.md:600-604) now states the check-docs exception explicitly: seeded copy 'writes it to a temporary directory outside the repository, repoints each lane's repo at it, and bank deletes it.' §6.4:1616-1617 and §11:2229-2230 both cross-reference it ('a docs round's seeded copy of its lane files outside it (D10)'). Code (Rounds.jl mktempdir, Preflight.jl repoint) matches. grep 'inside the project' found no other unqualified seed claims."
    },
    {
      "id": "2026-09-11-check-docs-01/rationale#1",
      "verdict": "ABSENT",
      "evidence": "ARCHITECTURE.md:996 now indents `Scan.jl` at 4 spaces (sibling of `CLI/`, same level as `GBGCodingTools.jl`), not the 6-space CLI-child level used by Git.jl/Ledger.jl/etc. Matches actual `src/Scan.jl` and `include(\"Scan.jl\")` at GBGCodingTools.jl:87. grep for other Scan.jl tree mentions in docs found none."
    }
  ]
}
