{
  "schema_version": 1,
  "lane": "built-html",
  "graded_sha256": "b79ed176ea5e0b4df178c939ee36f2d56e1678b50d7eb0d5905cf586ccb76fbb",
  "pass_nonce": "9d99391b7f985c834c5e6cfc4e76855b",
  "verdicts": [
    {
      "id": "2026-09-09-check-docs-02/built-html#1",
      "verdict": "ABSENT",
      "evidence": "docs/src/architecture.md:383 now reads '*Personal-scope symlinked skills, one per instrument under `~/.claude/skills/`*' — no asterisk inside the backtick span. Built page shows clean <em>...<code>~/.claude/skills/</code></em> with no stray backticks in any text node in the whole file; grep for '*`...*`' patterns across docs/src found none."
    },
    {
      "id": "2026-09-09-check-docs-02/built-html#2",
      "verdict": "ABSENT",
      "evidence": "docs/src/architecture.md:2327 now backticks both: '`built_html` + `.gbg/scratch/public_surface.json`'. Built html row renders as <code>built_html</code> + <code>.gbg/scratch/public_surface.json</code>, no <em>. Scanned whole scans table: every other built_html mention is likewise backticked."
    },
    {
      "id": "2026-09-09-check-docs-02/built-html#3",
      "verdict": "ABSENT",
      "evidence": "docs/src/guide/rules.md:648 now reads '`RULE.TEST.RULE_WITH_CHECK`'s own terms' (backticked). Built rules.html shows <code>RULE.TEST.RULE_WITH_CHECK</code>, no <em>. Grepped all bare RULE.* mentions in docs/src: remaining ones are inline-code headings or inside a fenced TOML block (not markdown-parsed); <em> search in built pages finds only unrelated JSON/YAML."
    },
    {
      "id": "2026-09-09-check-docs-02/built-html#4",
      "verdict": "ABSENT",
      "evidence": "src/CLI/Config.jl:167-168 docstring now states 'the `glossary` file exists and a non-empty `built_html` has a `docs/` directory beside it', matching code lines 200-201 exactly. Built docs/build/api/Config.html confirms both checks named. Mapped all 12 push!(errs) sites to docstring clauses; all covered."
    }
  ]
}
