{
  "schema_version": 1,
  "lane": "workflow-scripts",
  "graded_sha256": "b79ed176ea5e0b4df178c939ee36f2d56e1678b50d7eb0d5905cf586ccb76fbb",
  "pass_nonce": "00afdb50d463330866ebc84ce1e8a7df",
  "verdicts": [
    {
      "id": "2026-09-09-check-docs-02/workflow-scripts#1",
      "verdict": "ABSENT",
      "evidence": "audit.js:50 now lists `previously_worked` in the base item `required` array; schemaFor (lines 56-64) strips it only for lanes with key !== 'behaviour-change', so the behaviour-change lane keeps it required and an omission now fails validation. Passes.jl:289 default unchanged but unreachable for that lane."
    },
    {
      "id": "2026-09-09-check-docs-02/workflow-scripts#2",
      "verdict": "ABSENT",
      "evidence": "panel.js:88 needs.includes('git') branch now reads: 'you may use Bash with git ... scope every search with `--glob '!.gbg/**'`. Never open anything under .gbg/ beyond the files named above, and never ~/.gbg/.' — matches verify-act.js:59 and verify-state.js:51."
    },
    {
      "id": "2026-09-09-check-docs-02/workflow-scripts#3",
      "verdict": "ABSENT",
      "evidence": "hunt.js:74 FREE_PREAMBLE (used by the free lane, line 92) now reads: 'Nothing under `.gbg/` or `~/.gbg/` is yours to open but the files this prompt names; scope every grep with `--glob '!.gbg/**'`.' — matches HUNT_PREAMBLE's boundary language."
    },
    {
      "id": "2026-09-09-check-docs-02/workflow-scripts#4",
      "verdict": "ABSENT",
      "evidence": "dismissals.js:7 Args comment now reads '{ schema_version, round, repo, package, items: [{id, title}], items_sha, items_path, out, models: {economy} }' — items_sha is present, matching the runtime check at line 16 and the write at line 63."
    },
    {
      "id": "2026-09-09-check-docs-02/workflow-scripts#5",
      "verdict": "ABSENT",
      "evidence": "rubric-audit.js:74-75 computes `misassigned` (hat keys with no match in A.hats) BEFORE the hatKeys filter, logs it (line 76), folds it into `orphaned`/tally.MISSED (lines 116-117), and writes misassigned/orphaned/gaps into the output JSON (line 122) — logged and given a tally path, exceeding the hint."
    }
  ]
}
