{
  "schema_version": 1,
  "lane": "operational-claims",
  "graded_sha256": "50be23464e9d7fd6938d2fd0251b7925db18a1e3663b5f3de9d41c673f54b0f6",
  "pass_nonce": "b35dac7075583b939d7c23623cc6a420",
  "verdicts": [
    {
      "id": "2026-09-09-check-docs-01/operational-claims#1",
      "verdict": "ABSENT",
      "evidence": "src/TreeHash.jl:47 now reads `_nonempty(path, skip) || continue` (not the buggy `isempty(_nonempty(...))`). Ran the actual function over a dir with an empty subdirectory: produced 4b825dc642cb6eb9a060e54bf8d69288fbee4904, matching git's real empty-tree id from `git write-tree`. grep for `isempty(_nonempty` across src/ext/docs: no hits."
    },
    {
      "id": "2026-09-09-check-docs-01/operational-claims#2",
      "verdict": "ABSENT",
      "evidence": "src/Witnesses.jl:173: `f == 0 && blocked !== nothing && return WitnessResult(name, :blocked, p, f, e, blocked)` — now requires f==0. Docstrings (lines 33, 148) updated to 'errored and failed nothing'/'failed nothing'. Only one :blocked-producing branch in the file; no other site re-derives this condition."
    }
  ]
}
