{
  "schema_version": 1,
  "lane": "built-html",
  "graded_sha256": "9c0bccf80add89c6a05f0c08696278701eb8f5228eab2a7b944f8810562abcd6",
  "pass_nonce": "9d1c7af7febedace903c429b77375257",
  "verdicts": [
    {
      "id": "2026-09-10-check-docs-03/built-html#1",
      "verdict": "PRESENT",
      "evidence": "policy/docs-rubric.md:70 still has raw \"[`f`](@ref)\"; docs/build/guide/rules.html still renders literal \"[<code>f</code>](@ref)\" (unlinked) after \"the allocating\", matching the finding exactly."
    }
  ]
}
