{
  "schema_version": 1,
  "lane": "operational-claims",
  "graded_sha256": "b79ed176ea5e0b4df178c939ee36f2d56e1678b50d7eb0d5905cf586ccb76fbb",
  "pass_nonce": "00afdb50d463330866ebc84ce1e8a7df",
  "verdicts": [
    {
      "id": "2026-09-09-check-docs-02/operational-claims#1",
      "verdict": "PARTIAL",
      "evidence": "Scan.jl:452,466 now gate the DEAD branch on isempty(r.hits) too, so report() no longer drops hits — fixed. But the identical unguarded predicate survives at src/CLI/Rounds.jl:168: `r.population == 0 && r.exempted == 0 && println(io, \"prepare: DEAD scan $(r.id)...\")` prints DEAD with no isempty(r.hits) check, and field_docs.jl:39-60's `checked` still never counts NOLIST hits, so a FIELD_DOCS-only-NOLIST case still gets falsely announced as DEAD there.",
      "surviving_class": "src/CLI/Rounds.jl:168 (same population==0&&exempted==0-without-hits-check pattern, printed as a DEAD status line during `gbg round prepare`)"
    },
    {
      "id": "2026-09-09-check-docs-02/operational-claims#2",
      "verdict": "ABSENT",
      "evidence": "src/TestHarness.jl:298 now reads \"searched after `pkg` and before `modules`\", matching the flatten order at line 304 ((pkg,), externals, modules). Grepped 'searched last'/'externals' across src: no remaining contradiction."
    },
    {
      "id": "2026-09-09-check-docs-02/operational-claims#3",
      "verdict": "ABSENT",
      "evidence": "src/Reflection.jl:421-424: the def === :extension check and continue now run BEFORE examined[] += 1 (moved after the skip branch), so extension-homed bindings no longer increment examined. Only one examined[] += site exists (grepped)."
    },
    {
      "id": "2026-09-09-check-docs-02/operational-claims#4",
      "verdict": "ABSENT",
      "evidence": "src/CLI/Config.jl:168-169 docstring now reads \"the fixed path docs/make.jl a consumer's docs_build command is expected to run\" — no longer claims the path is derived FROM docs_build. Code still hardcodes the path (line 207), now truthfully described."
    },
    {
      "id": "2026-09-09-check-docs-02/operational-claims#5",
      "verdict": "ABSENT",
      "evidence": "src/CLI/Main.jl:33-35 docstring now reads \"Any --name=value is a value whatever valued says; an option named in valued also consumes the following bare argument as its value; every other bare --name is a flag\" — matches the code's =-branch-first order exactly."
    },
    {
      "id": "2026-09-09-check-docs-02/operational-claims#6",
      "verdict": "ABSENT",
      "evidence": "src/TestHarness.jl:190-191 now reads \"a frozen count differing from its ideal must carry a named holder\" (not \"above\"), matching the != check at line 206 and Traffic's own docstring at line 164."
    },
    {
      "id": "2026-09-09-check-docs-02/operational-claims#7",
      "verdict": "ABSENT",
      "evidence": "src/Scans/sibling_link.jl:17-35: the loop no longer breaks after the first mention; it continues over all lines, flagging elseif linked on later mentions. Comment at line 16-18 now states \"Both halves of the rule are checked\"."
    },
    {
      "id": "2026-09-09-check-docs-02/operational-claims#8",
      "verdict": "ABSENT",
      "evidence": "src/Scans/prose_shape.jl:1-9 header now says caps \"bind on every docstring and every NEW page unit; a page unit already in the baseline is held by the ratchet alone\" — matches the later comment (lines 104-106) and the occursin(\" :: \", k) || b === nothing code exactly; no more blanket ALWAYS claim."
    },
    {
      "id": "2026-09-09-check-docs-02/operational-claims#9",
      "verdict": "ABSENT",
      "evidence": "src/CLI/Rounds.jl:253 docstring now separates \"absent\" from \"renamed to <name>.rejected.json beside itself — unparsable or invalid\". All three quarantining mv calls (lines 266,271,274) now uniformly use replace(p, \".json\" => \".rejected.json\")."
    },
    {
      "id": "2026-09-09-check-docs-02/operational-claims#10",
      "verdict": "ABSENT",
      "evidence": "Preflight.jl:202-206 and Recall.jl:8,77-78,90-92 now state only siteonly narrows the manuscript; every other substrate gets the full seeded text — confirmed against instruments/check-consistency/workflow/panel.js:60 (h.substrate === 'siteonly' ? siteonly : full). suspect_hats' siteonly-only filter now matches documented and actual delivery."
    }
  ]
}
