{
  "lane": "rationale-3",
  "graded_sha256": "8ac12038a92f2e24939230fff642d1513464be2a2ecbe5be014e99b15362f257",
  "pass_nonce": "3e7a502082c092d8ca593516e9124d8e",
  "schema_version": 1,
  "verdicts": [
    {
      "id": "2026-09-12-check-docs-01/rationale-3#1",
      "verdict": "ABSENT",
      "evidence": "docs/ARCHITECTURE.md:1962-1965 now opens the whole subsection '**Step-0 instrument-equivalence test. NOT YET BUILT**' and states the CLI refuses both non-empty round import and round compare with exit 2, matching src/CLI/Rounds.jl:876-880 exactly. Searched for 'round import <pile' and 'round compare' — no other site claims it built."
    },
    {
      "id": "2026-09-12-check-docs-01/rationale-3#2",
      "verdict": "ABSENT",
      "evidence": "docs/ARCHITECTURE.md:1981-1984 now reads 'It is to run before init, on a tree with no .gbg/config.toml — which the CLI does not yet allow, since cmd_round reads the config before dispatching any round verb, and the implemented --empty path calls neither guard nor self verify'. Confirmed against Rounds.jl:856 (cfg=Config.read() unconditional) and import_empty (no guard/self_verify call)."
    },
    {
      "id": "2026-09-12-check-docs-01/rationale-3#3",
      "verdict": "ABSENT",
      "evidence": "docs/ARCHITECTURE.md:2463 now reads 'Measured over this package on 2026-09-12, before it was built: 964 references, 11 unresolved... Those figures are that day's snapshot; the scan re-measures on every run'; line 2370 (SIGNATURE_MIRROR) says 'Narrowed to names on 2026-09-12... so no count is carried here' — the stale 247/251 count was removed, not just dated."
    }
  ]
}
