{
  "schema_version": 1,
  "lane": "built-html",
  "graded_sha256": "b79ed176ea5e0b4df178c939ee36f2d56e1678b50d7eb0d5905cf586ccb76fbb",
  "pass_nonce": "a077d88211883f1c622e65e04d77c955",
  "verdicts": [
    {
      "id": "2026-09-09-check-docs-02/built-html#1",
      "verdict": "ABSENT",
      "evidence": "docs/src/architecture.md:383-384 now reads '*Personal-scope symlinked skills, one per instrument under `~/.claude/skills/`*:' — no trailing glob asterisk inside the code span. Built page renders clean: '<em>Personal-scope...<code>~/.claude/skills/</code></em>: deliver...' through all five alternatives, no stray tags/backticks. grep '\\*`[^`]*\\*`' over docs/src: no hits — class not present elsewhere."
    },
    {
      "id": "2026-09-09-check-docs-02/built-html#2",
      "verdict": "ABSENT",
      "evidence": "docs/src/architecture.md:2327 now reads '`built_html` + `.gbg/scratch/public_surface.json`' (backticked). Built architecture.html row renders '<code>built_html</code> + <code>.gbg/scratch/public_surface.json</code>' plainly. grep for bare 'built_html' outside backticks across docs/src: no hits."
    },
    {
      "id": "2026-09-09-check-docs-02/built-html#3",
      "verdict": "ABSENT",
      "evidence": "docs/src/guide/rules.md:648 now reads '`RULE.TEST.RULE_WITH_CHECK`'s own terms' (backticked). Built rules.html renders '<code>RULE.TEST.RULE_WITH_CHECK</code>' with no <em> mid-word. Grepped for bare RULE.*_* ids in flowing prose (excluding @id anchors/headers) across rules.md and architecture.md: none found."
    },
    {
      "id": "2026-09-09-check-docs-02/built-html#4",
      "verdict": "ABSENT",
      "evidence": "src/CLI/Config.jl:163-170 docstring now enumerates: surface globs, anchors, module blocks, [paths] dirs, 'the `glossary` file exists and a non-empty `built_html` has a `docs/` directory beside it', extensions, docs/make.jl, executable_claims, seed_catalog — matching every push!(errs,...) site in check_paths (lines 172-211), including the two previously-omitted glossary and built_html/docs checks."
    }
  ]
}
