{
  "schema_version": 1,
  "lane": "rulebook",
  "graded_sha256": "9c0bccf80add89c6a05f0c08696278701eb8f5228eab2a7b944f8810562abcd6",
  "pass_nonce": "876502a63d9bafe897380fbd889ec85d",
  "verdicts": [
    {
      "id": "2026-09-10-check-docs-03/rulebook#1",
      "verdict": "PARTIAL",
      "evidence": ".gbg/policy/00-index.md now reads 'Five values vary by package ... rubric.leading_identity, notation.vectors, docs.admonition_titles, notation.mathbf_allowed and the tier RULE.DOC.ARGCOV binds at' — fixed at that site.",
      "surviving_class": "docs/src/guide/config.md:17 still opens 'Four values vary by package and are substituted into the rendered policy: rubric.leading_identity, notation.vectors, docs.admonition_titles, notation.mathbf_allowed' then patches with 'the fifth variation point ... is a tier' — same undercount defect verbatim."
    }
  ]
}
