{
  "schema_version": 1,
  "lane": "rationale",
  "graded_sha256": "b79ed176ea5e0b4df178c939ee36f2d56e1678b50d7eb0d5905cf586ccb76fbb",
  "pass_nonce": "6114c300132fdcbf435699389e69184a",
  "verdicts": [
    {
      "id": "2026-09-09-check-docs-02/rationale#1",
      "verdict": "ABSENT",
      "evidence": "docs/ARCHITECTURE.md:625 now reads 'Sixteen schemas' listing exactly the 16 names matching `ls schema/*.schema.json` (16 files, verified). Text explicitly states lane-file wrapper and bug-hunt's candidate shape 'live inline in each instrument's own schema.json, not as files under schema/'. Line 1001 says 'the sixteen of D11'."
    },
    {
      "id": "2026-09-09-check-docs-02/rationale#2",
      "verdict": "ABSENT",
      "evidence": "docs/ARCHITECTURE.md:1721-1722 QUICK formula now ends '...POL.SENTINEL, SELF.CONSUMER, AUDIT.GAP}', matching src/CLI/Doctor.jl:42 QUICK array. Line 1726 reads 'AUDIT.* other than AUDIT.GAP ... are never in QUICK', qualifying the old absolute claim consistently with the code."
    },
    {
      "id": "2026-09-09-check-docs-02/rationale#3",
      "verdict": "ABSENT",
      "evidence": "docs/ARCHITECTURE.md:2330 now has a `SCAN.ARGS_FORM` row (rule RULE.DOC.ARGS_FORM, triage, src/ext, julia, fixture wrong-args-form). grep '| `SCAN\\.' returns 43 rows = 42 concrete scans (matches catalog/scans.toml's 42 [[scan]] entries) + SCAN.CUSTOM placeholder."
    },
    {
      "id": "2026-09-09-check-docs-02/rationale#4",
      "verdict": "ABSENT",
      "evidence": "docs/ARCHITECTURE.md:949-967 CLI/ tree block now lists Git.jl, Ledger.jl, Passes.jl, RoundFiles.jl and Self.jl each with a one-line description, alongside all prior entries, matching `ls src/CLI/*.jl` (25 files) with none omitted."
    }
  ]
}
